{
 "work": "sadi.qawaid_jamia",
 "status": "candidate",
 "provenance": "Machine-normalised from two OCR witnesses (archive-pdf1995, archive-pdf1995-tess; body headings and closing index); statements cleaned of OCR noise, glosses and kinds proposed. Awaiting human review (Review.tla: only human review admits a record).",
 "kinds": {
  "meta": "about the law, its evidence or its weighing",
  "default": "presumption or default status",
  "closure": "closure of rulings under a relation",
  "taqsim": "partition into cases",
  "farq": "distinction between similar cases",
  "rule": "substantive general rule",
  "procedure": "procedure or proof",
  "interpretation": "reading of utterances and acts"
 },
 "rules": [
  {
   "number": 1,
   "statement_ar": "الشارع لا يأمر إلا بما مصلحته خالصة أو راجحة، ولا ينهى إلا عما مفسدته خالصة أو راجحة",
   "gloss_en": "The Lawgiver commands only what is purely or preponderantly beneficial, and forbids only what is purely or preponderantly harmful.",
   "kind": "meta",
   "domain": "general",
   "lean": [
    "Usul.Sadi.Q01",
    "Usul.Sadi.q01_balanced_is_mubah"
   ]
  },
  {
   "number": 2,
   "statement_ar": "الوسائل لها أحكام المقاصد",
   "gloss_en": "Means take the rulings of their ends.",
   "kind": "closure",
   "domain": "general",
   "lean": [
    "Usul.Sadi.q02_means_of_wajib",
    "Usul.Qawaid.closure_respects_capacity"
   ]
  },
  {
   "number": 3,
   "statement_ar": "المشقة تجلب التيسير",
   "gloss_en": "Hardship brings ease (all dispensations derive from this).",
   "kind": "default",
   "domain": "general",
   "lean": [
    "Usul.Sadi.q04_relief_never_binds"
   ]
  },
  {
   "number": 4,
   "statement_ar": "الوجوب يتعلق بالاستطاعة؛ فلا واجب مع العجز، ولا محرم مع الضرورة",
   "gloss_en": "Obligation depends on capacity: no obligation with inability, no prohibition with necessity.",
   "kind": "default",
   "domain": "general",
   "lean": [
    "Usul.Sadi.operative",
    "Usul.Sadi.q04_no_wajib_with_inability",
    "Usul.Sadi.q04_no_haram_with_necessity",
    "Usul.Sadi.q04_ordinary_case"
   ]
  },
  {
   "number": 5,
   "statement_ar": "الشريعة مبنية على أصلين: الإخلاص للمعبود، والمتابعة للرسول ﷺ",
   "gloss_en": "The law rests on two foundations: sincerity towards the One worshipped, and following the Messenger.",
   "kind": "meta",
   "domain": "ibadat",
   "lean": []
  },
  {
   "number": 6,
   "statement_ar": "الأصل في العبادات الحظر، والأصل في العادات الإباحة",
   "gloss_en": "The default in acts of worship is prohibition; in customs, permission.",
   "kind": "default",
   "domain": "general",
   "lean": [
    "Usul.Domain.default",
    "Usul.Sadi.q06_no_worship_without_dalil",
    "Usul.Sadi.q06_customs_permitted_by_default",
    "Usul.Sadi.q06_dalil_prevails"
   ]
  },
  {
   "number": 7,
   "statement_ar": "التكليف وهو البلوغ والعقل شرط لوجوب العبادات، والتمييز شرط لصحتها إلا الحج والعمرة",
   "gloss_en": "Legal responsibility (maturity and reason) conditions the obligation of worship; discernment conditions its validity, except ḥajj and ʿumra.",
   "kind": "rule",
   "domain": "ibadat",
   "lean": [
    "Usul.Subject.IsMukallaf",
    "Usul.no_taklif_without_mukallaf"
   ]
  },
  {
   "number": 8,
   "statement_ar": "الأحكام الأصولية والفروعية لا تتم إلا بأمرين: وجود شروطها وأركانها، وانتفاء موانعها",
   "gloss_en": "Rulings, in principles and branches, hold only when their conditions and pillars are present and their impediments absent.",
   "kind": "meta",
   "domain": "general",
   "lean": [
    "Usul.Sadi.Gate.Holds",
    "Usul.Sadi.q08_missing_condition",
    "Usul.Sadi.q08_present_impediment"
   ]
  },
  {
   "number": 9,
   "statement_ar": "العرف والعادة يرجع إليه في كل حكم حكم به الشارع ولم يحده بحد",
   "gloss_en": "Custom decides every ruling the Lawgiver set without defining its measure.",
   "kind": "meta",
   "domain": "general",
   "lean": [],
   "emendation": "OCR (both witnesses): «يرجح»; read «يرجع» (custom is the reference for undefined measures)."
  },
  {
   "number": 10,
   "statement_ar": "البينة على المدعي، واليمين على من أنكر",
   "gloss_en": "Proof is on the claimant, the oath on the one who denies.",
   "kind": "procedure",
   "domain": "muamalat",
   "lean": []
  },
  {
   "number": 11,
   "statement_ar": "الأصل بقاء ما كان على ما كان، واليقين لا يزول بالشك",
   "gloss_en": "What was remains as it was; certainty is not removed by doubt.",
   "kind": "default",
   "domain": "general",
   "lean": [
    "Usul.Sadi.q11_yaqin",
    "Usul.Qawaid.yaqin_la_yazul_bish_shakk"
   ]
  },
  {
   "number": 12,
   "statement_ar": "لا بد من التراضي في عقود المعاوضات",
   "gloss_en": "Mutual consent is required in contracts of exchange.",
   "kind": "rule",
   "domain": "muamalat",
   "lean": []
  },
  {
   "number": 13,
   "statement_ar": "الإتلاف يستوي فيه المتعمد والجاهل والناسي",
   "gloss_en": "In destruction of property the deliberate, the ignorant and the forgetful are alike (liable).",
   "kind": "rule",
   "domain": "muamalat",
   "lean": []
  },
  {
   "number": 14,
   "statement_ar": "التلف في يد الأمين غير مضمون إذا لم يتعد أو يفرط، وفي يد الظالم مضمون مطلقاً",
   "gloss_en": "Loss in a trustee's hand is not compensable unless he transgressed or was negligent; in a wrongdoer's hand it is compensable absolutely.",
   "kind": "farq",
   "domain": "muamalat",
   "lean": []
  },
  {
   "number": 15,
   "statement_ar": "لا ضرر ولا ضرار",
   "gloss_en": "No harm and no reciprocal harm.",
   "kind": "rule",
   "domain": "general",
   "lean": []
  },
  {
   "number": 16,
   "statement_ar": "العدل واجب في كل شيء، والفضل مسنون",
   "gloss_en": "Justice is obligatory in everything; generosity is recommended.",
   "kind": "taqsim",
   "domain": "general",
   "lean": [
    "Usul.Sadi.Conduct.status",
    "Usul.Sadi.q16_adl_binding_fadl_not"
   ]
  },
  {
   "number": 17,
   "statement_ar": "من تعجل شيئاً قبل أوانه عوقب بحرمانه",
   "gloss_en": "Whoever hastens a thing before its time is punished by being deprived of it.",
   "kind": "rule",
   "domain": "general",
   "lean": []
  },
  {
   "number": 18,
   "statement_ar": "تضمن المثليات بمثلها، والمتقومات بقيمتها",
   "gloss_en": "Fungibles are compensated with their like, non-fungibles with their value.",
   "kind": "taqsim",
   "domain": "muamalat",
   "lean": []
  },
  {
   "number": 19,
   "statement_ar": "إذا تعذر المسمى رجع إلى القيمة",
   "gloss_en": "When the stipulated price is unattainable, one reverts to the value.",
   "kind": "default",
   "domain": "muamalat",
   "lean": []
  },
  {
   "number": 20,
   "statement_ar": "إذا تعذر معرفة من له الحق جعل كالمعدوم",
   "gloss_en": "When the right-holder cannot be identified, he is treated as non-existent.",
   "kind": "default",
   "domain": "muamalat",
   "lean": []
  },
  {
   "number": 21,
   "statement_ar": "الغرر والميسر محظور في المعاوضات والمغالبات",
   "gloss_en": "Uncertainty (gharar) and gambling are forbidden in exchanges and contests.",
   "kind": "rule",
   "domain": "muamalat",
   "lean": []
  },
  {
   "number": 22,
   "statement_ar": "الصلح جائز بين المسلمين إلا صلحاً أحل حراماً أو حرم حلالاً",
   "gloss_en": "Settlement between Muslims is permitted, except a settlement that permits the forbidden or forbids the permitted.",
   "kind": "rule",
   "domain": "muamalat",
   "lean": [
    "Usul.Sadi.Voids",
    "Usul.Sadi.q22_valid_iff_preserves_prohibition"
   ]
  },
  {
   "number": 23,
   "statement_ar": "والمسلمون على شروطهم إلا شرطاً أحل حراماً أو حرم حلالاً",
   "gloss_en": "Muslims are bound by their stipulations, except a stipulation that permits the forbidden or forbids the permitted (printed under one heading with Q22).",
   "kind": "rule",
   "domain": "muamalat",
   "lean": [
    "Usul.Sadi.Voids",
    "Usul.Sadi.q22_valid_iff_preserves_prohibition"
   ]
  },
  {
   "number": 24,
   "statement_ar": "من سبق إلى المباحات فهو أحق بها",
   "gloss_en": "Whoever reaches unowned permissible things first has the better right to them.",
   "kind": "rule",
   "domain": "muamalat",
   "lean": []
  },
  {
   "number": 25,
   "statement_ar": "تشرع القرعة إذا جهل المستحق وتعذرت القسمة",
   "gloss_en": "Lots are prescribed when the entitled party is unknown and division is impossible.",
   "kind": "procedure",
   "domain": "muamalat",
   "lean": []
  },
  {
   "number": 26,
   "statement_ar": "يقبل قول الأمناء فيما تحت أيديهم من التصرفات والإتلاف وغيرها، إلا ما خالف الحس والعادة",
   "gloss_en": "Trustees are believed about what is in their hands, except where sense and custom contradict them.",
   "kind": "procedure",
   "domain": "muamalat",
   "lean": []
  },
  {
   "number": 27,
   "statement_ar": "من ترك المأمور جهلاً أو نسياناً لم تبرأ ذمته إلا بفعله، ومن فعل المحظور وهو معذور بجهل أو نسيان برئت ذمته",
   "gloss_en": "Omitting a command through ignorance or forgetfulness does not discharge it until performed; committing a prohibition excused by ignorance or forgetfulness is discharged.",
   "kind": "farq",
   "domain": "general",
   "lean": [
    "Usul.Sadi.dischargedByExcuse",
    "Usul.Sadi.q27_asymmetry"
   ]
  },
  {
   "number": 28,
   "statement_ar": "يقوم البدل مقام المبدل، ولكن لا يصار إليه إلا إذا تعذر الأصل",
   "gloss_en": "The substitute stands in for the original, but is resorted to only when the original is impossible.",
   "kind": "rule",
   "domain": "general",
   "lean": [
    "Usul.Sadi.useSubstitute",
    "Usul.Sadi.q28_substitute_only_when_needed"
   ]
  },
  {
   "number": 29,
   "statement_ar": "يجب تقييد اللفظ بملحقاته من وصف أو شرط أو استثناء أو غيرها",
   "gloss_en": "An utterance must be qualified by its attachments: description, condition, exception and the like.",
   "kind": "interpretation",
   "domain": "lafz",
   "lean": []
  },
  {
   "number": 30,
   "statement_ar": "الشركاء في الأملاك والحقوق والمنافع يلزم الممتنع منهم بما يعود على المشترك من الأمور الضرورية",